{
  "skillId": "ingest-core-release",
  "status": "SUCCEEDED",
  "coreRepositoryUnchanged": true,
  "discoveredVersions": ["9.2.0", "9.2.1"],
  "findings": [
    {
      "version": "9.2.0",
      "statement": "CspAdditionalFrameSrc config key added; Core.csproj TargetFramework unchanged at net10.0",
      "source": "both",
      "crossCheck": "CONFIRMED_BY_DIFF_AND_NOTES",
      "evidence": "git diff v9.1.0..v9.2.0 -- **/appsettings*.json; release-notes.md#9.2.0"
    },
    {
      "version": "9.2.1",
      "statement": "NGO.Model/Domain/IATIExport/IATIActivities.cs removed; IATI export aligned to global IATI model types",
      "source": "git-diff",
      "crossCheck": "OBSERVED_IN_DIFF_NOT_MENTIONED_IN_NOTES",
      "evidence": "git diff v9.2.0..v9.2.1 --stat"
    }
  ],
  "candidateRefs": [
    "../../ingest/knowledge/candidates/releases/9.2.0.json",
    "../../ingest/knowledge/candidates/releases/9.2.1.json"
  ],
  "wroteToCanonical": false,
  "changelogDraftRef": "runs/synthetic-acme/run-1/artifacts/ingest-core-release/changelog-draft.md",
  "unresolvedItems": [
    "9.2.1: IATIActivities.cs removal has no corresponding release-notes.md entry — confirm with Core team before promoting to canonical."
  ],
  "nextAction": "Developer: review the shared candidate records at ../../ingest/knowledge/candidates/releases/9.2.0.json and 9.2.1.json (and the changelog draft), resolve the unresolvedItems entry, then promote to knowledge/canonical/versions/ if accurate."
}
